{
  "schema_version": "1.0.0",
  "engine": "opinion-piece-engine",
  "engine_version": "1.1.0",
  "created_at": null,
  "mode": "develop",
  "release_status": "research_needed",
  "assumptions": ["No target venue has been selected."],
  "thesis_candidates": [],
  "selected_thesis_id": null,
  "claims": [],
  "evidence": [],
  "components": [],
  "openings": [],
  "draft": null,
  "headlines": [],
  "editorial_queries": [],
  "scorecard": null,
  "artifacts": {
    "thesis_slate": {"path": null, "status": "pending", "sha256": null},
    "argument_map": {"path": null, "status": "pending", "sha256": null},
    "editorial_queries": {"path": null, "status": "pending", "sha256": null}
  }
}
